{
  "id": "ctfl-v4.0.1",
  "name": {
    "tr": "Sertifikalı Test Uzmanı Temel Seviye",
    "en": "Certified Tester Foundation Level"
  },
  "acronym": "CTFL",
  "stream": "core",
  "level": "foundation",
  "syllabusVersion": "4.0.1",
  "syllabusReleaseDate": "2024-09-15",
  "status": "active",
  "exam": {
    "questionCount": 40,
    "totalPoints": 40,
    "passPoints": 26,
    "passPercent": 65,
    "durationMinutes": 60,
    "pointsPerQuestion": 1,
    "negativeMarking": null,
    "questionKLevelDistribution": { "K1": 8, "K2": 24, "K3": 8 }
  },
  "glossaryUsedIn": { "syllabus": "Foundation", "version": "v4.0" },
  "sources": {
    "syllabusEn": "https://istqb.org/?sdm_process_download=1&download_id=3345",
    "syllabusTr": "https://www.turkishtestingboard.org/files/pdfs/ISTQB_CTFL_Syllabus-v4.0.1.pdf",
    "examRules": "https://istqb.org/?sdm_process_download=1&download_id=3829",
    "examTables": "https://istqb.org/?sdm_process_download=1&download_id=3832",
    "glossaryApi": "https://api.glossary.istqb.org/v1/terms",
    "sampleExamsEn": "https://istqb.org/sdm_categories/certified-tester-foundation-level-ctfl-v4-0/",
    "sampleExamsTr": "https://www.turkishtestingboard.org/en/certified-tester-foundation-level-sample-exam-turkish/"
  },
  "officialSampleExams": [
    {
      "set": "A",
      "lang": "tr",
      "url": "https://www.turkishtestingboard.org/temel-seviye-sertifikali-test-uzmani-ornek-sinav-turkce/",
      "publisher": "Turkish Testing Board",
      "documentVersion": "1.5"
    },
    {
      "set": "B",
      "lang": "tr",
      "url": "https://www.turkishtestingboard.org/sertifikali-test-uzmani-temel-seviye-ctfl-v4-0-ornek-sinavi-b-turkce/",
      "publisher": "Turkish Testing Board",
      "documentVersion": "1.6"
    },
    {
      "set": "C",
      "lang": "tr",
      "url": "https://www.turkishtestingboard.org/sertifikali-test-uzmani-temel-seviye-ctfl-v4-0-ornek-sinavi-c-turkce/",
      "publisher": "Turkish Testing Board",
      "documentVersion": "1.6"
    },
    {
      "set": "D",
      "lang": "tr",
      "url": "https://www.turkishtestingboard.org/sertifikali-test-uzmani-temel-seviye-ctfl-v4-0-ornek-sinavi-d-turkce/",
      "publisher": "Turkish Testing Board",
      "documentVersion": "1.5"
    },
    {
      "set": "A-D",
      "lang": "en",
      "url": "https://istqb.org/sdm_categories/certified-tester-foundation-level-ctfl-v4-0/",
      "publisher": "ISTQB"
    }
  ]
}
